{
  "schema_version": "0.1",
  "receipt_type": "pages_artifact_binding_receipt",
  "repository": "StegVerse-Labs/admissibility-wiki",
  "target_commit": "1111111111111111111111111111111111111111",
  "source_candidate": {
    "path": "reports/pages-build-verification-candidate.json",
    "sha256": "2222222222222222222222222222222222222222222222222222222222222222",
    "verification_state": "PAGES_BUILD_PASS_ARTIFACT_PENDING",
    "build_manifest_sha256": "3333333333333333333333333333333333333333333333333333333333333333"
  },
  "observed_workflow": {
    "run_id": 1,
    "job_id": 2,
    "run_attempt": 1
  },
  "artifact": {
    "name": "github-pages",
    "artifact_id": 3,
    "artifact_digest": "sha256:4444444444444444444444444444444444444444444444444444444444444444",
    "preserved": true
  },
  "verification_state": "PAGES_ARTIFACT_PRESERVED",
  "canonical_status_mutation_applied": false,
  "deployment_authorized": false,
  "public_verification_complete": false,
  "release_authorized": false,
  "downstream_propagation_authorized": false,
  "required_next_transition": "apply_observed_pages_artifact_evidence_to_canonical_status_in_separate_governed_commit",
  "non_claims": [
    "artifact preservation is not deployment authority",
    "artifact preservation is not public verification",
    "artifact binding does not mutate canonical status",
    "artifact binding does not authorize release",
    "artifact binding does not authorize downstream propagation",
    "build success and artifact upload do not establish governance standing"
  ]
}
